{
  "schema_version": "1.2",
  "item_id": "YT-09",
  "youtube_video_id": "Inxe5Bgarj0",
  "attested_at": "2026-07-16T18:13:23Z",
  "content_rights": {
    "state": "provisionally_allowed_for_private_benchmark_review_required",
    "evidence_url": "https://svs.gsfc.nasa.gov/14754/",
    "rationale": "NASA/SVS publishes the main horizontal item under its baseline; licensed music and individually credited visuals remain excluded from transcript-only processing.",
    "review_required": true
  },
  "transcript_rights": {
    "state": "provisionally_allowed_for_private_benchmark_review_required",
    "evidence_url": "https://svs.gsfc.nasa.gov/14754/",
    "rationale": "NASA/SVS publishes the main non-reel VTT as an official same-group caption asset. Private preservation is provisional under the cited terms; legal/policy review remains required.",
    "review_required": true
  },
  "source": {
    "owner": "NASA Goddard Space Flight Center",
    "source_page_url": "https://svs.gsfc.nasa.gov/14754/",
    "sidecar_url": "https://svs.gsfc.nasa.gov/vis/a010000/a014700/a014754/14755PandoraToSCaptions.en_US.vtt",
    "sidecar_sha256": "b2deffeae00423fad86435395f72bfa18cd143ba4fb1789ca13c93b023c80539",
    "private_relative_path": "inputs/nasa/YT_PANDORA_Inxe5Bgarj0.vtt"
  },
  "input_contract": {
    "format": "vtt",
    "language_tag": "en-US",
    "declared_duration_ms": 89792,
    "expected_cue_count": 15,
    "last_cue_end_ms": 89380,
    "content_completeness": {
      "state": "complete",
      "basis": "explicit_source_assertion",
      "rationale": "The official source publishes the complete horizontal-rendition transcript; the vertical reel is excluded and the 0.412-second tail remains recorded."
    },
    "expected_class": "eligible_supported"
  },
  "retention_and_derivation": {
    "full_text_private": true,
    "publication": "hashes_and_derived_metrics_only",
    "embeddings": "not_created",
    "model_upload": "prohibited_in_protocol_v2",
    "delete_by": "2026-10-14",
    "evidence_url": "https://www.nasa.gov/nasa-brand-center/images-and-media/",
    "rationale": "Caption-only private evaluation; the horizontal and vertical versions remain separated and media are link-only."
  },
  "attribution": {
    "credit": "NASA's Goddard Space Flight Center and item-specific visual contributors",
    "no_endorsement": true,
    "third_party_caveats": ["Universal Production Music and individually credited visual material are not retained or redistributed."]
  },
  "version_equivalence": {
    "state": "official_row_level_publication_association",
    "evidence": "The main horizontal group co-locates Pandora_ToS_Best.mp4, the main non-REEL sidecars/transcript, and exact official YouTube link; the vertical reel is excluded.",
    "youtube_side_verified": false
  },
  "claims_boundary": ["input_preservation_only", "not_independent_wer_reference", "youtube_caption_state_unverified", "not_legal_approval", "not_production_readiness"]
}
